{
  "schema": "gamecult.eve.provider_handoff.v1",
  "providerId": "aetheria",
  "ownerRepo": "Aetheria",
  "currentHostRepo": "Eve",
  "advertisementPath": "web/fixtures/aetheria.provider-advertisement.json",
  "scenarioPath": "web/fixtures/aetheria-world-scenario.json",
  "fixtureIds": [
    "aetheria-world"
  ],
  "authorityBoundary": "Aetheria owns daemon state, generated world state, assets, command authorization, receipts, and provider scenarios. Eve owns only the provider advertisement, surface, command, and conformance contracts used to consume those surfaces.",
  "moveSets": [
    {
      "id": "provider-advertisement",
      "destinationOwner": "Aetheria",
      "currentPaths": [
        "web/fixtures/aetheria.provider-advertisement.json"
      ],
      "replacementProof": "Aetheria publishes provider advertisements from typed daemon state or CultMesh records."
    },
    {
      "id": "interactive-world-surface",
      "destinationOwner": "Aetheria",
      "currentPaths": [
        "web/fixtures/aetheria-world-surface.json",
        "web/fixtures/aetheria-world-surface.conformance.json"
      ],
      "replacementProof": "Aetheria owns RTS/ARPG world surface fixtures, generated level state, and assets."
    },
    {
      "id": "unity-playable-world-asset-manifest",
      "destinationOwner": "Aetheria",
      "currentPaths": [
        "web/fixtures/aetheria.unity-playable-world-asset-manifest.json"
      ],
      "replacementProof": "Aetheria owns provider-authored Unity playable-world asset manifest documents; EveUnity only consumes the typed manifest contract."
    },
    {
      "id": "provider-scenario",
      "destinationOwner": "Aetheria",
      "currentPaths": [
        "web/fixtures/aetheria-world-scenario.json",
        "scripts/run-aetheria-conformance-consumer-smoke.ps1"
      ],
      "replacementProof": "Aetheria owns provider scenario conformance, command receipts, and replay fixtures."
    }
  ],
  "contractInputs": [
    "gamecult.eve.surface.v1",
    "gamecult.eve.command.v1",
    "gamecult.eve.unity_playable_world_asset_manifest.v1",
    "gamecult.eve.provider_advertisement.v1",
    "gamecult.eve.provider_scenario.v1",
    "gamecult.eve.conformance_export.v1"
  ],
  "forbiddenImports": [
    "Eve fixture paths as product authority",
    "renderer-local Aetheria game state",
    "Unity or web client state as daemon truth",
    "plugin internals bypassing advertised provider commands"
  ],
  "requiredExternalProofs": [
    "Aetheria publishes its provider advertisement from owner-owned daemon state.",
    "Aetheria exports provider fixtures or conformance packs without depending on Eve source layout.",
    "Aetheria command receipts are generated by the daemon command boundary.",
    "Unity and web clients consume Aetheria surfaces through provider advertisements and command intents."
  ]
}
